<?xml version="1.0" encoding="UTF-8"?>
<ns2:Fill_Out_Camera_Sheets xmlns:ns2="http://www.yawlfoundation.org/sb/cameraInfo" xmlns:xsi="http://www.w3.org/2001/XMLSchema-instance" xsi:schemaLocation="http://www.yawlfoundation.org/sb/cameraInfo ../cameraInfoType.xsd ">
  <generalInfo>
    <production>production</production>
    <date>2001-01-01</date>
    <weekday>weekday</weekday>
    <shootDayNo>0</shootDayNo>
  </generalInfo>
  <producer>producer</producer>
  <director>director</director>
  <directorOfPhotography>directorOfPhotography</directorOfPhotography>
  <cameraOperator>cameraOperator</cameraOperator>
  <cameraAssistant>cameraAssistant</cameraAssistant>
  <cameraInfo>
    <sheetNumber>0</sheetNumber>
    <camRoll>camRoll</camRoll>
    <studios_location>studios_location</studios_location>
    <techInfo>
      <cameraType_and_Number>cameraType_and_Number</cameraType_and_Number>
      <stockNumber>stockNumber</stockNumber>
      <emulsion>emulsion</emulsion>
      <totalCansNumber>0</totalCansNumber>
    </techInfo>
    <slateInfo>
      <magNumber>magNumber</magNumber>
      <slate>slate</slate>
      <takeInfo>
        <take>0</take>
        <counter>0</counter>
        <length>0</length>
        <print>true</print>
        <printSetting>printSetting</printSetting>
        <essentialInfo>essentialInfo</essentialInfo>
      </takeInfo>
    </slateInfo>
    <shortEndMin>0</shortEndMin>
    <camInfoSum>
      <footageLoaded>0</footageLoaded>
      <totalExposed>0</totalExposed>
      <shortEnds>0</shortEnds>
      <waste>0</waste>
    </camInfoSum>
    <instructionsToLab>instructionsToLab</instructionsToLab>
    <signatureOfCameraAssistant>signatureOfCameraAssistant</signatureOfCameraAssistant>
  </cameraInfo>
  <anotherRoll>true</anotherRoll>
  <stockInfo>
    <loaded>0</loaded>
    <gross>0</gross>
    <exposed>0</exposed>
    <print>0</print>
    <N_G>0</N_G>
    <waste>0</waste>
    <shortEnds>0</shortEnds>
  </stockInfo>
  <camRolls>camRolls</camRolls>
</ns2:Fill_Out_Camera_Sheets>
